Email,Category
"Could you please send me the syllabus for the ""Introduction to Machine Learning"" course? I need to review the topics for the upcoming semester.",student
Could you provide the dates for the mid-semester exams? I want to plan my study schedule accordingly.,student
"I missed the lecture on Week 3 for ""Data Structures and Algorithms."" Could you share the lecture slides with me?",student
I wanted to confirm your office hours for this semester. When is the best time to come by for course-related discussions?,student
"Could you please confirm the time and venue for the final exams of the ""Advanced Mathematics"" course?",student
"Could you help me access the research papers for my ""Artificial Intelligence"" class? I’m having trouble locating them in the university's repository.",student
"Could you share the guidelines for the upcoming assignment on ""Database Management Systems""? I’m unclear on the format requirements.",student
"Could you resend the Zoom link for the ""Ethical Hacking"" course? I couldn’t find it in my email.",student
"I need access to the course material for the ""Software Engineering"" class. Could you point me to where I can download the files?",student
Could you let me know the procedure to access the digital library from off-campus? I need to retrieve research materials for my project.,student
"Could you provide the lab schedule for the ""Embedded Systems"" course? I need to attend extra sessions to complete my experiment.",student
"Could you clarify the attendance policy for the ""Data Science"" course? I want to ensure I meet the required attendance percentage.",student
"Could you help me access last year’s exam papers for the ""Theory of Computation"" course? It would help me prepare better for the finals.",student
"Could you share the template for the final project report in ""Operating Systems""? I want to ensure I'm following the correct format.",student
"Could you tell me when the grades for the ""Machine Learning"" midterm will be published? I’m eager to know my results.",student
"Could you provide the group assignment list for the ""Software Testing"" course? I want to reach out to my group members.",student
"Could you confirm if there are any changes to the ""Algorithms"" course schedule for next week? I heard there might be a holiday.",student
"Are the recordings for the ""Cybersecurity"" course lectures available online? I missed the last session and need to catch up.",student
"Could you share the study material for the upcoming ""Digital Signal Processing"" exam? I need to revise specific topics.",student
"Could you clarify how class participation is being graded for the ""Cloud Computing"" course? I want to ensure I’m on track.",student
I hope this email finds you well. I'm enrolled in CS101 this semester and was wondering if I could get a copy of the course syllabus. I'd like to review the course content and prepare accordingly.,student
I'm writing to inquire about the final exam schedule for this semester. Could you please provide me with the dates and times for the exams in the Computer Science department?,student
I'm a new student and I'm not sure how to access the university's online library resources. Could you please guide me on how to log in and use the digital library?,student
I wanted to confirm the deadline for course registration for the upcoming semester. Could you please let me know the last date to add or drop courses?,student
I'm interested in taking the Advanced AI course next semester. Could you please inform me about the prerequisites for this course?,student
I'm enrolled in MATH201 for the upcoming semester. Could you please provide me with the required textbook information for this course?,student
I'm in your Database Systems class this semester. Could you please share your office hours schedule?,student
I'm a junior majoring in Computer Science. Could you please provide me with a list of the remaining courses I need to take to fulfill my graduation requirements?,student
I'm interested in getting involved in research. Could you please inform me about any ongoing research projects or opportunities available for undergraduate students in our department?,student
I heard that the university provides free software for students. Could you please let me know what software is available and how I can access it?,student
I have an internship opportunity this summer. I was wondering if it's possible to receive course credit for this internship and what the process would be.,student
I'm working on my master's thesis this semester. Could you please inform me about the final submission deadline for theses?,student
I'm struggling with some concepts in the Programming Fundamentals course. Are there any tutorial sessions available for this course?,student
I'm interested in applying for scholarships for the next academic year. Could you please provide information on available scholarships and the application process?,student
I'm considering withdrawing from a course this semester. Could you please explain the procedure for course withdrawal and any potential impacts on my academic record?,student
I'm interested in studying abroad next year. Could you please provide information about the study abroad programs available for Computer Science students?,student
I need to obtain an official academic transcript for a scholarship application. Could you please guide me on how to request an official transcript?,student
I heard that our department hosts regular seminars. Could you please share the schedule of upcoming departmental seminars?,student
"I'm in your Data Structures class this semester. Could you please clarify the grading policy for the course, particularly the weightage for assignments, midterm, and final exam?",student
I often need to use the computer lab for my projects. Could you please inform me about the operating hours of the Computer Science department's computer lab?,student
I'm Dr. Amelia Rodriguez from the University of Barcelona's AI Research Lab. We've been following your groundbreaking work on neural network optimization. We're initiating a project on AI in climate modeling and believe your expertise would be invaluable,student
"I'm Sarah Johnson, HR Manager at TechInnovate Inc. We're looking to offer summer internships to promising CS students from your university. The internships will focus on machine learning and data analytics. Could you please share information about your top-performing junior and senior students?",student
I'm a postdoctoral researcher from MIT planning a visit to your university next month. I'm particularly interested in your particle accelerator facility. Could you please provide information about the process for external researchers to access this facility?,student
I hope this email finds you well. I'm writing to inquire if you'd be willing to give a guest lecture in our Advanced Cryptography course next month. Your recent paper on quantum-resistant encryption algorithms has generated a lot of interest among our graduate students. We believe a lecture from you would be incredibly valuable.,student
"I'm a Ph.D. candidate in the Biology department, currently finalizing my thesis. I have a few questions about the submission format: 1. Is a specific citation style required? 2. Should figures be embedded in the text or presented in a separate section?",student
I'm reaching out from Quantum Dynamics Ltd. We're a leading quantum computing company and we're interested in establishing a long-term partnership with your university. We envision this partnership including: - Joint research projects - Internship programs for your students - Funding for a new quantum computing lab,student
"I'm an alumnus of the Chemistry department, class of 2015. I heard that the department now publishes a monthly newsletter highlighting recent research and achievements. Could you please add me to the mailing list for this newsletter? I'd love to stay updated on the exciting work happening in my old department.",student
I'm currently a sophomore majoring in Economics. I'm considering adding a second major in Data Science. Could you please provide information on: 1. The requirements for a double major 2. How many additional credits I would need to complete 3. Any restrictions or prerequisites I should be aware of I appreciate your guidance in this matter.,student
"I'm preparing to submit an application for the National Science Foundation grant. I have a few questions: 1. Is there a specific format for the budget justification section? 2. Do you offer any internal review of proposals before submission? 3. What is the internal deadline for submission, considering the NSF deadline is August 15th?",student
A group of us are interested in starting a new Artificial Intelligence and Ethics club. Could you please provide information on: 1. The process for getting a new student club approved 2. Any funding opportunities available for new clubs 3. Guidelines for club constitution and leadership structure,student
I'm a junior majoring in Mechanical Engineering with a keen interest in renewable energy technologies. I was wondering if there are any opportunities for undergraduates to get involved in research projects in this field. Do you have any ongoing projects where you might need assistance? I'm particularly interested in solar energy optimization.,student
I'm writing on behalf of Global Tech Solutions. We're interested in setting up a corporate training program in Advanced Machine Learning for our data science team. We were impressed by your department's expertise in this area and wondered if you could offer a customized 6-week intensive program for our employees. Could we arrange a call to discuss this possibility further?,student
"I'm writing to report an issue in Oakwood Hall, Room 302. The air conditioning unit has been making loud noises and isn't cooling effectively. This has been ongoing for about a week and is affecting my ability to study in my room. Could you please send someone to check and repair it?",student
"I'm a working professional interested in pursuing a master's degree in Business Analytics. I saw that your university offers online programs, but I couldn't find specific information about this particular degree. Is the Business Analytics program available online? If so, could you provide details about the curriculum, duration, and admission requirements?",student
"Our research group in the Chemistry department is in need of a new high-performance liquid chromatography (HPLC) system. Our current system is outdated and affecting the accuracy of our experiments. We've identified a suitable model that costs approximately $50,000. Could you please advise on the process for requesting this purchase and if there are any departmental funds available?",student
I'm reaching out from Innovate Robotics Inc. We're interested in participating in your upcoming Engineering Career Fair. Could you please provide information on: 1. The date and location of the event 2. Costs associated with setting up a booth 3. Any opportunities for giving a short presentation to students,student
"I'm a Ph.D. candidate in the Environmental Science program, about to begin my thesis work. I'm writing to inquire about the process of forming my thesis committee. Specifically: 1. How many members should be on the committee? 2. Can I include an external member from another university? 3. What's the timeline for submitting the committee for approval?",student
"On behalf of the Student AI Society, I'm writing to invite you to be a guest speaker at our annual AI Symposium. The event is scheduled for November 15th and the theme this year is ""AI Ethics in the Age of Big Data"". Given your extensive work in this area, we believe your insights would be invaluable to our attendees. Would you be available and willing to give a 45-minute talk followed by a Q&A session?",student
"I'm Dr. Yuki Tanaka from Kyoto University. I recently read your paper on climate change effects on marine ecosystems in the Pacific. The dataset you used for your analysis would be incredibly valuable for a meta-analysis I'm conducting. Would it be possible to share your raw data? Of course, we would fully credit your work in any resulting publications.",student
I'm a tenured professor in the History department and I'm considering applying for a sabbatical next academic year. Could you please provide information on: 1. The application process and deadlines 2. Eligibility criteria 3. Any restrictions on activities during the sabbatical period,student
"I'm a new student with a hearing impairment, starting my studies next semester. I wanted to inquire about the services available to support my learning: 1. Are sign language interpreters available for lectures? 2. Do you provide any assistive listening devices? 3. What is the process for requesting accommodations for exams?",student
"I'm Dr. John Smith from the University of Cambridge. Our team is embarking on a large-scale study on the effects of climate change on global food security. Given your expertise in agricultural economics, we believe your input would greatly enhance our research. Would you be interested in joining our international consortium? We have funding secured and anticipate this project running for the next three years.",student
"I'm writing from TechCorp regarding Sarah Johnson, a student from your Computer Science department who interned with us this summer. We were extremely impressed with Sarah's performance and technical skills. We would like to extend her an offer for a full-time position upon graduation. Before proceeding, we wanted to check if you had any additional insights about Sarah's academic performance or any other feedback that might be relevant.",student
"As the new head of the Microbiology department, I'm conducting a review of our laboratory safety protocols. Could you please provide: 1. The most recent university-wide safety guidelines 2. Any specific protocols for handling Level 2 biohazardous materials 3. Schedule for the next mandatory safety training session for our staff",student
"I'm a third-year Ph.D. student in the Physics department. I've had a paper accepted for presentation at the International Conference on Quantum Computing in Zurich this fall. I'm writing to inquire if there are any departmental or university funds available to support conference attendance. The estimated costs for travel, accommodation, and registration are approximately $2,500.",student
"I'm a recent graduate from the Business School, class of 2023. I heard about the alumni mentorship program and I'm very interested in participating as a mentee. Could you please provide more information about 1. How mentors and mentees are matched 2. The expected time commitment 3. How to apply for the program",student
I'm preparing to begin a new research project involving human subjects. The study will investigate the psychological effects of prolonged social media use on teenagers. Could you please provide guidance on: 1. The process for submitting an ethics approval application 2. Any specific considerations for research involving minors 3. Typical timeline for the review process I want to ensure all ethical considerations are thoroughly addressed before proceeding.,student
"I'm reaching out on behalf of SpaceX. We've been consistently impressed with the quality of graduates from your Aerospace Engineering program. As such, we would like to become more involved with your department's development. We'd like to propose establishing an Industry Advisory Board for the Aerospace Engineering department, with SpaceX as a founding member. This board could provide insights on industry trends, suggest curriculum updates, and potentially offer internship and research opportunities.",student
"As professors in the Computer Science and Philosophy departments respectively, we'd like to propose a new interdisciplinary course titled ""Ethical Implications of Artificial Intelligence"". This course would cover technical aspects of AI as well as explore the ethical considerations of its implementation in various sectors.",student
I'm a second-year Master's student in the Mathematics department. I'm interested in applying for a Graduate Teaching Assistant position for the upcoming semester. Could you please provide information on: 1. The application process and required documents 2. Deadline for submissions 3. Typical responsibilities and time commitment,student
"I'm reaching out from AutoTech Industries. We're upgrading our R&D lab and have several pieces of high-quality equipment that we'd like to donate to educational institutions. The equipment includes a CNC machine, a 3D printer, and various testing devices, all in excellent condition. We believe these could be valuable additions to your department's labs. Would you be interested in this donation? If so, we can discuss the details of transportation and any potential tax implications.",student
I'm planning to participate in a study abroad program at the University of Tokyo next semester. I have a few questions about credit transfer: 1. How do I ensure the courses I take will be recognized by our university? 2. Is there a limit to how many credits I can transfer? 3. Will my GPA from the study abroad program affect my overall GPA?,student
I'm Dr. Elena Petrova from the Russian Academy of Sciences. I've been following your groundbreaking work on quantum entanglement and believe there could be interesting synergies with my research on quantum cryptography. Would you be open to discussing a potential collaboration? We have access to some unique experimental setups that could complement your theoretical work.,student
Our research team in the Bioengineering department has developed a novel method for targeted drug delivery using nanoparticles. We believe this innovation has significant commercial potential and would like to file a patent. Could you please guide us through the patent filing process? Specifically: 1. What information do we need to provide? 2. Are there any university resources available to assist with the patent search and application? 3. How are potential royalties typically handled?,student
We're hosting a distinguished guest lecturer in the Economics department next month. I wanted to inquire about the process for arranging an honorarium: 1. Is there a standard amount we offer to guest lecturers? 2. What paperwork needs to be completed? 3. How long does the payment process typically take?,student
I'm a junior majoring in International Business. I'm very interested in participating in a student exchange program next year. Could you please provide information on: 1. Partner universities offering business programs 2. Application deadlines and requirements 3. Any language proficiency requirements 4. Available scholarships or financial aid for exchange students,student
"Our research group in the Genomics department is generating large amounts of sequencing data. We're looking for a secure, scalable storage solution. Could you advise on: 1. Available university cloud storage options 2. Data backup and recovery protocols 3. Any tools for large dataset management and sharing with external collaborators",student
"As the new chair of the Sociology department, I'm keen to organize a workshop on inclusive teaching practices for our faculty. Could you help with: 1. Recommending potential facilitators for such a workshop 2. Suggested topics or frameworks we should cover 3. Best practices for encouraging faculty participation",student
I'm reaching out from GreenTech Innovations. We're interested in sponsoring a research project related to sustainable energy storage solutions. We've identified Professor Lisa Chen in your Materials Science department as a potential collaborator. Could you provide guidance on: 1. The process for establishing a sponsored research agreement 2. University policies on intellectual property rights for sponsored research 3. Typical timelines for setting up such partnerships,student
I'm a professor in the History department and I've recently completed a manuscript for a textbook on Modern European History. I'm interested in having it published through our university press. Could you please inform me about: 1. The submission and review process 2. Typical timeline from submission to publication 3. Any specific formatting requirements for the manuscript,student
The Chemistry department's main teaching laboratory is in need of significant updates to meet current safety standards and accommodate new equipment. We would like to request a comprehensive renovation. Could you please advise on: 1. The process for submitting a formal renovation request 2. Typical timeline for such projects 3. Any preliminary information you need from us to start the planning process This renovation is crucial for maintaining the quality of our practical teaching sessions.,student
"I'm planning to convert my popular on-campus course ""Introduction to Artificial Intelligence"" into an online format. I'm new to online teaching and would appreciate your support. Specifically: 1. What resources are available to help faculty develop online courses? 2. Is there training available on best practices for online instruction? 3. What is the process for getting an online course approved and listed?",student
"I'm the principal investigator on the NSF grant #12345. Due to unexpected equipment failure, we need to reallocate some funds from the travel budget to equipment replacement. Could you please advise on: 1. The process for requesting a budget modification 2. Any restrictions on moving funds between budget categories 3. Typical timeline for approval of such requests",student
"As a faculty advisor, I've noticed an increase in students reporting stress and anxiety. I want to ensure I'm providing them with the best possible support and referrals. Could you please provide: 1. An overview of the mental health services available to students 2. Any resources for faculty on recognizing signs of student distress 3. The process for referring a student to counseling services",student
"Our interdisciplinary research team, comprising members from Computer Science, Neuroscience, and Psychology, is embarking on a large-scale project on brain-computer interfaces. We're in need of a shared lab space to facilitate our collaboration. Could you please advise on: 1. The availability of suitable spaces on campus 2. The process for requesting and allocating shared research spaces 3. Any costs associated with space renovation or equipment installation",student
The Engineering Student Association is planning to launch a monthly Industry Guest Speaker Series. We believe this would provide valuable insights and networking opportunities for our students. We would appreciate your support in: 1. Connecting us with potential speakers from various engineering fields 2. Advising on the logistics of hosting such events 3. Helping promote the series to students and alumni,student
I'm writing to report a potential violation of research ethics that I've observed in a colleague's project. The issue involves the handling of sensitive participant data. I would like to discuss: 1. The proper procedure for reporting such concerns 2. How the committee investigates these reports 3. Measures in place to protect whistleblowers,student
"At TechGlobal Inc., we've been very impressed with the interns from your Computer Science department. We're interested in expanding our internship program to include students from Electrical Engineering and Data Science. Could you please advise on: 1. The process for establishing a formal internship partnership 2. Any career fairs or events where we could connect with students 3. University policies regarding internship duration and compensation",student
"I'm a professor in the Physics department, and I have a student who is visually impaired enrolled in my upcoming ""Classical Mechanics"" course. I want to ensure that all my teaching materials and methods are accessible. Could you please provide guidance on: 1. Best practices for making physics lectures and demos accessible 2. Any available resources for converting equations and diagrams into accessible formats 3. Training opportunities for faculty on inclusive teaching methods",student
"As a proud alumnus of the university (Class of 1985, Economics), I would like to make a substantial donation to establish a scholarship fund for underprivileged students in the Economics department. Could you please provide information on: 1. The process for setting up a named scholarship fund 2. Minimum donation amounts required for such an endowment 3. How scholarship recipients are typically selected",student
I'm writing to submit my sabbatical research proposal for the upcoming academic year. My project focuses on the impact of climate change on marine ecosystems in the Mediterranean. I would appreciate your review and feedback on: 1. The scope and objectives of the project 2. Proposed collaborations with international research institutions 3. Expected outcomes and their alignment with university research priorities,student
"As the treasurer of the Robotics Club, I'm writing to request funding for our upcoming participation in the National Robotics Competition. We would greatly appreciate your support for: 1. Travel expenses for our team of 10 students 2. Materials for building and upgrading our competition robot 3. Registration fees for the competition",student
