Email,Category
I'm a second-year Master's student in the Mathematics department. I'm interested in applying for a Graduate Teaching Assistant position for the upcoming semester. Could you please provide information on: 1. The application process and required documents 2. Deadline for submissions 3. Typical responsibilities and time commitment,student
I am a final-year student and would like to inquire if your department has any internship opportunities related to urban infrastructure projects. I would appreciate your guidance on how to apply.,research
"Could you let me know the office hours for Professor [Professor Name] from the ""Computer Networks"" course? I have some questions regarding the last lecture.",student
The U.S. State Department is seeking interns for our diplomatic corps program. We're looking for students with strong language skills and international relations knowledge. Can we discuss how to best present this opportunity to your students?,corporate
"Our company, TechInnovate, has 5 summer internship positions available for Computer Science students. Could you please share this opportunity with relevant students and departments?",student
AeroFarms is launching an innovation program focused on vertical farming technologies. We're offering 5 paid positions for your top students. Could we discuss how to integrate this opportunity with your curriculum?,corporate
Our group at Qatar Computing Research Institute is studying Arabic NLP. Your dialect classification data would help validate our approach. Could we discuss?,research
I'm interested in getting involved in research. Could you please inform me about any ongoing research projects or opportunities available for undergraduate students in our department?,student
I'm a postdoctoral researcher from MIT planning a visit to your university next month. I'm particularly interested in your particle accelerator facility. Could you please provide information about the process for external researchers to access this facility?,student
We have full-time positions and internships available in HR consulting. Could you guide us on how to proceed with recruiting students from your department?,corporate
"I hope you're doing well. I wanted to ask if you could provide a list of recommended books for the ""Database Systems"" course. I’m looking for additional reading material to deepen my understanding of the subject.",student
ITER is offering internships in fusion energy research. We have positions for 5 exceptional nuclear engineering students. How can we work with your department to identify the most qualified candidates?,corporate
"Could you share the template for the final project report in ""Operating Systems""? I want to ensure I'm following the correct format.",student
DARPA is proposing a research collaboration on drone swarm coordination algorithms. We're interested in involving your top researchers and PhD students. Can we set up a meeting to explore this potential partnership?,corporate
"I'm reaching out on behalf of SpaceX. We've been consistently impressed with the quality of graduates from your Aerospace Engineering program. As such, we would like to become more involved with your department's development. We'd like to propose establishing an Industry Advisory Board for the Aerospace Engineering department, with SpaceX as a founding member. This board could provide insights on industry trends, suggest curriculum updates, and potentially offer internship and research opportunities.",student
ITER is proposing a research collaboration on quantum simulation techniques for fusion energy optimization. We're looking to involve your quantum computing experts in this crucial energy research. How can we arrange a meeting to discuss the scope of this potential project?,corporate
Corteva Agriscience is seeking academic partners for our research in CRISPR-based crop enhancement for climate resilience. We're interested in involving your top biotechnology researchers. Can we schedule a call to explore this potential collaboration?,corporate
Our group at Brazil's National Laboratory for Scientific Computing is studying ML for drug discovery. Your molecular property prediction benchmarks would help validate our methods. Could we discuss access?,research
"I’m working on a term paper for the ""Information Retrieval"" course and was wondering if you could recommend any reference materials or textbooks on advanced indexing techniques. I want to make sure I cover all the relevant topics.",student
I'm from Norwegian Computing Center studying Arctic climate modeling. Would it be possible to access your polar weather prediction metrics? It would help our analysis.,research
Writing from University of Michigan about your robotics research. Could we use your manipulation planning dataset? It would help our analysis significantly.,research
The Engineering Student Association is planning to launch a monthly Industry Guest Speaker Series. We believe this would provide valuable insights and networking opportunities for our students. We would appreciate your support in: 1. Connecting us with potential speakers from various engineering fields 2. Advising on the logistics of hosting such events 3. Helping promote the series to students and alumni,student
We are looking to recruit interns for our summer program in the area of automotive design. Please let us know the process to connect with eligible students in your department.,corporate
We are interested in recruiting students for roles in business intelligence and data analysis. Could you assist us in setting up a placement drive for your department?,corporate
" Our team at Berkeley is researching neural networks. Your recent paper on deep learning optimization caught our attention. Could we access your benchmark datasets? Looking forward to your response.",research
Our company is developing new renewable materials and would like to collaborate with your department on this project. Could we discuss a joint research partnership?,research
Boston Dynamics is expanding our robotics internship program. We have 10 positions available for students with experience in mechanical design and control systems. Can we collaborate on identifying suitable candidates?,corporate
Microsoft Quantum is seeking academic partners for quantum algorithm development. We're interested in collaborating with your top researchers. Could we set up a call to explore potential research areas?,corporate
"Our interdisciplinary research team, comprising members from Computer Science, Neuroscience, and Psychology, is embarking on a large-scale project on brain-computer interfaces. We're in need of a shared lab space to facilitate our collaboration. Could you please advise on: 1. The availability of suitable spaces on campus 2. The process for requesting and allocating shared research spaces 3. Any costs associated with space renovation or equipment installation",student
FinCorp is keen on establishing a direct placement partnership with your MBA program. We're looking to hire 20+ graduates annually. Can we arrange a call to discuss how we can formalize this arrangement and potentially offer pre-placement talks?,corporate
"Could you confirm whether there will be any changes to the class timings for ""Artificial Intelligence"" next week? I’ve heard there might be a holiday, and I want to plan my schedule accordingly.",student
Writing from University of Washington about your ML security work. Could we use your adversarial attack dataset? It would help our defense mechanisms.,research
Rigetti Computing is launching a research initiative on quantum computing applications in drug discovery. We're seeking academic partners for this project. Could we arrange a call to discuss how your department could contribute to this groundbreaking work?,corporate
Lockheed Martin Skunk Works is proposing a joint research initiative on aerospace metamaterials. We're interested in partnering with your department for this cutting-edge work. Could we schedule a meeting to explore potential collaboration areas?,corporate
We would like to invite you to deliver a guest lecture on recent advancements in data science at our upcoming industry event. Could you confirm your availability for this?,research
"Due to unexpected delays in my data collection, I'm writing to request a two-week extension on my thesis submission deadline. My current deadline is May 15th. Would it be possible to extend this to May 29th?",student
"Our group at Yale is studying deep learning. Your experimental data would be valuable for comparison. Could you share access details? ",research
Foster + Partners is offering internships focused on integrating smart materials in architectural design. We have positions for 5 innovative students. How can we collaborate to identify candidates with the right blend of creativity and technical skills?,corporate
I am a postgraduate student specializing in robotics and would like to inquire about internship opportunities within your department. I am particularly interested in gaining hands-on experience in autonomous systems.,research
Reaching out from ETH Zurich regarding your work on reinforcement learning. Would you be willing to share your experimental data? It would greatly help our research.,research
Google AI is forming a confidential AI Ethics Advisory Board and we'd like to invite a representative from your department to join. This is a sensitive matter requiring discretion. Could we schedule a private call to discuss the details?,corporate
Ginkgo Bioworks is initiating a confidential project in synthetic biology. We're seeking to involve select faculty and graduate students from your department. Could we arrange a secure meeting to discuss this sensitive opportunity?,corporate
Microsoft Quantum is seeking academic partners for quantum algorithm development. We're interested in collaborating with your top researchers. Could we set up a call to explore potential research areas?,corporate
Zyvex Labs is seeking academic partners for our research in atomically precise manufacturing. We're interested in collaborating with your top researchers and PhD students. Can we arrange a call to explore potential research areas?,corporate
"At TechGlobal Inc., we've been very impressed with the interns from your Computer Science department. We're interested in expanding our internship program to include students from Electrical Engineering and Data Science. Could you please advise on: 1. The process for establishing a formal internship partnership 2. Any career fairs or events where we could connect with students 3. University policies regarding internship duration and compensation",student
Our team at Boston University is studying neural architectures. Your ablation study data would be valuable for our research. Could you help?,research
"I'm an alumnus of the Chemistry department, class of 2015. I heard that the department now publishes a monthly newsletter highlighting recent research and achievements. Could you please add me to the mailing list for this newsletter? I'd love to stay updated on the exciting work happening in my old department.",student
I have an internship opportunity this summer. I was wondering if it's possible to receive course credit for this internship and what the process would be.,student
"I wanted to ask if there are any extra credit opportunities available for the ""Introduction to Machine Learning"" course. I’d like to improve my grade before the end of the semester.",student
"Writing from Delft University about your federated learning research. Could we use your communication efficiency datasets? Looking forward to hearing back. ",research
"I missed last week’s lab session for ""Computer Networks."" Could you please provide me with the materials and instructions for completing the lab? I need to catch up on the experiment.",student
"I'm preparing to submit an application for the National Science Foundation grant. I have a few questions: 1. Is there a specific format for the budget justification section? 2. Do you offer any internal review of proposals before submission? 3. What is the internal deadline for submission, considering the NSF deadline is August 15th?",student
"On behalf of the Student AI Society, I'm writing to invite you to be a guest speaker at our annual AI Symposium. The event is scheduled for November 15th and the theme this year is ""AI Ethics in the Age of Big Data"". Given your extensive work in this area, we believe your insights would be invaluable to our attendees. Would you be available and willing to give a 45-minute talk followed by a Q&A session?",student
I'm researching at University of Illinois on federated learning. Would it be possible to access your privacy preservation results?,research
Our organization is launching a research project focused on data privacy in digital ecosystems and would like to explore a partnership with your department. Could we schedule a meeting to discuss this opportunity?,research
Writing from Czech Technical University about your ML verification work. Could we use your formal proof datasets for our study?,research
I'm reaching out from Innovate Robotics Inc. We're interested in participating in your upcoming Engineering Career Fair. Could you please provide information on: 1. The date and location of the event 2. Costs associated with setting up a booth 3. Any opportunities for giving a short presentation to students,student
Unilever is offering internships focused on sustainable packaging innovation. We have 8 positions available for environmental engineering students. How can we collaborate to identify the most suitable candidates?,corporate
We are looking to recruit legal experts from your faculty to provide corporate law training to our in-house legal team. Could you help facilitate this recruitment and provide recommendations?,corporate
EcoConstruct Inc. is offering internships focused on sustainable infrastructure design. We'd like to provide 8-10 positions for your civil engineering students. How can we best integrate this with your department's internship program?,corporate
"I noticed that some of the lecture slides for the ""Advanced Algorithms"" course haven’t been uploaded yet. Could you please update the materials on the course portal so I can review them before the next class?",student
"As the new head of the Microbiology department, I'm conducting a review of our laboratory safety protocols. Could you please provide: 1. The most recent university-wide safety guidelines 2. Any specific protocols for handling Level 2 biohazardous materials 3. Schedule for the next mandatory safety training session for our staff",student
NanoTech Industries has 5 internship positions available in our cutting-edge nanomaterials lab. We're particularly interested in students working on graphene applications. How can we promote this opportunity to your top students?,corporate
Our group at CISRO's Data61 is studying privacy-preserving ML. Your anonymization benchmark results would be valuable for comparison. Could we discuss? Best wishes,research
We are working on a large-scale big data analytics project and would like to propose a research partnership with your department. We believe your expertise in data mining would significantly benefit our project.,research
We are interested in offering internships in chemical processing and would like to connect with students from your department. Could you guide us on how to initiate this collaboration?,research
Waymo is expanding our internship program in autonomous vehicle perception systems. We have 12 positions available. Could we discuss how to integrate this opportunity with your computer vision curriculum?,corporate
Our group at National University of Singapore is studying federated learning. Your privacy preservation benchmarks would help validate our methods. Could we discuss access?,research
I'm Dr. Elena Petrova from the Russian Academy of Sciences. I've been following your groundbreaking work on quantum entanglement and believe there could be interesting synergies with my research on quantum cryptography. Would you be open to discussing a potential collaboration? We have access to some unique experimental setups that could complement your theoretical work.,student
"Could you confirm the guidelines for submitting the final thesis for the ""Data Science"" program? I want to ensure I’m meeting all the requirements.",student
Writing from INRIA about your ML security work. Could we use your adversarial training dataset? It would help our robustness analysis.,research
Jane Street is offering summer internships in quantitative trading. We're looking for students with strong mathematical and coding skills. How can we best present this opportunity to your finance and computer science students?,corporate
We are expanding our AI division and are looking to recruit experienced faculty members for industry-academia collaborations. Could you assist us in finding suitable candidates for part-time or full-time positions?,corporate
I'm writing to report a potential violation of research ethics that I've observed in a colleague's project. The issue involves the handling of sensitive participant data. I would like to discuss: 1. The proper procedure for reporting such concerns 2. How the committee investigates these reports 3. Measures in place to protect whistleblowers,student
Writing from Stanford regarding your recent work on AI algorithms. Would it be possible to get access to your training datasets? We're working on a comparative study and your data would be invaluable,research
Could you provide the dates for the mid-semester exams? I want to plan my study schedule accordingly.,student
I'm researching at Zhejiang University on quantum chemistry. Would it be possible to access your molecular simulation results?,research
"I’m interested in pursuing an independent study in ""Natural Language Processing"" next semester. Could you let me know how to propose a topic and what the process is for getting approval?",student
"The Debate Club is seeking approval for our annual budget of $2,500. This includes costs for tournament travel, guest speaker honorariums, and promotional materials. Could you please review and confirm if this budget is approved?",student
Rigetti Computing is launching a research initiative on quantum computing applications in drug discovery. We're seeking academic partners for this project. Could we arrange a call to discuss how your department could contribute to this groundbreaking work?,corporate
Our group at UCLA is studying deep learning. Your experimental data would be valuable for our research. Could you help?,research
I'm from University of Waterloo working on edge AI. Would it be possible to access your device-specific benchmarks? It would greatly help our optimization work.,research
Writing from Tesla AI about your autonomous systems research. Would it be possible to access your sensor data from recent trials? It would help validate our approaches.,research
I'm preparing to begin a new research project involving human subjects. The study will investigate the psychological effects of prolonged social media use on teenagers. Could you please provide guidance on: 1. The process for submitting an ethics approval application 2. Any specific considerations for research involving minors 3. Typical timeline for the review process I want to ensure all ethical considerations are thoroughly addressed before proceeding.,student
SecureNet Solutions has a sensitive project involving cybersecurity audits for government agencies. We're interested in involving your top students and faculty. Could we arrange a private meeting to discuss this potential collaboration?,corporate
Our research team in the Bioengineering department has developed a novel method for targeted drug delivery using nanoparticles. We believe this innovation has significant commercial potential and would like to file a patent. Could you please guide us through the patent filing process? Specifically: 1. What information do we need to provide? 2. Are there any university resources available to assist with the patent search and application? 3. How are potential royalties typically handled?,student
AutoBot Industries proposes a joint research initiative on advanced autonomous systems. This would involve sharing proprietary technology. Could we arrange a confidential meeting to explore this potential partnership?,corporate
Writing from DFKI about your human-AI interaction research. Could we use your human feedback datasets? It would help our analysis significantly. Regards,research
I represent the AI Lab at Harvard. Your department's work on facial recognition is groundbreaking. We'd like to request access to your annotated dataset. Hope to hear from you soon.,research
Writing from TU Munich about your robotics research. Would it be possible to use your manipulation task datasets?,research
We are working on a project focused on renewable water resources and would like to collaborate with your department on this research. Could we discuss potential areas for joint work?,research
"Could you confirm the dates for the mid-term exams for the ""Data Structures"" course? I want to plan my study schedule accordingly.",student
We are offering summer internships in corporate law and compliance. Could you assist us in reaching out to students who might be interested in these opportunities?,corporate
I'm from Kenya's iHub researching ML for agriculture. Your crop disease detection dataset would help validate our local models. Looking forward to your response.,research
Our group at King's College London is studying medical image analysis. Your annotation quality metrics would be valuable for comparison. Could you share access?,research
"I was unable to attend the last two lectures on ""Data Visualization"" due to personal reasons. Could you please share the class handouts or lecture notes with me? I want to ensure I’m up to date.",student
"I'm reaching out from the University of Tokyo. We're in the process of internationalizing our Engineering curriculum and would greatly value your insights, given your university's renowned global approach. We're particularly interested in: 1. Strategies for incorporating global perspectives into technical courses 2. Best practices for promoting intercultural competence among engineering students 3. Your experiences with international collaborative projects in engineering education",student
Our team at EPFL is working on neuromorphic computing. Your spike timing datasets would be perfect for our validation studies. Could you help?,research
"Could you confirm the date and time of the final exam for the ""Data Mining"" course? I want to make sure I’m prepared and don't miss it.",student
I'm researching at Intel Labs on quantum computing. Would it be possible to access your qubit stability data? Looking forward to your response.,research
"Writing from University of Montreal about your reinforcement learning work. Could we get access to your environment configurations? ",research
Google AI is forming a confidential AI Ethics Advisory Board and we'd like to invite a representative from your department to join. This is a sensitive matter requiring discretion. Could we schedule a private call to discuss the details?,corporate
I heard there will be a research seminar next month. Could you provide the schedule and registration details?,student
Could you share the data from your recent research on robotics path-planning algorithms? I am looking to compare results with my ongoing project.,research
"Emulate, Inc. is offering internships in organ-on-a-chip technology development. We have positions for 7 bioengineering students interested in drug discovery applications. How can we collaborate to identify the most qualified candidates?",corporate
The Ocean Cleanup is launching a research initiative on advanced technologies for ocean plastic removal. We're seeking academic partners for this crucial environmental work. Can we arrange a meeting to discuss potential collaboration areas?,corporate
I am having trouble accessing the university library’s digital resources. Could you provide instructions on how to log in remotely?,student
"As a proud alumnus of the university (Class of 1985, Economics), I would like to make a substantial donation to establish a scholarship fund for underprivileged students in the Economics department. Could you please provide information on: 1. The process for setting up a named scholarship fund 2. Minimum donation amounts required for such an endowment 3. How scholarship recipients are typically selected",student
A group of us are interested in starting a new Artificial Intelligence and Ethics club. Could you please provide information on: 1. The process for getting a new student club approved 2. Any funding opportunities available for new clubs 3. Guidelines for club constitution and leadership structure,student
I'm interested in studying abroad next year. Could you please provide information about the study abroad programs available for Computer Science students?,student
Could you confirm the dates for the mid-semester break? I need to plan my travel accordingly.,student
Softbank Robotics is launching an innovation program focused on soft robotics applications. We're offering 5 paid positions for your top students. How can we collaborate to identify the most innovative candidates?,corporate
Our team at Taiwan AI Labs is studying semiconductor defect detection. Your anomaly detection data would be valuable for our work. Could you share details? Thanks,research
